ID,en,de,type,lexical_category,low_en,high_en,low_de,high_de
71,regular,regulär,COGNATE,ADJ,He likes a <MASK> coffee every morning.,"The <MASK> train schedule was disrupted due to a mechanical issue, causing widespread delays for commuters.",Er mag jeden Morgen einen <MASK>-Kaffee.,"Der Fahrplan des <MASK>-Zugs wurde aufgrund eines mechanischen Problems unterbrochen, was zu erheblichen Verspätungen für Pendler führte."
72,social,sozial,COGNATE,ADJ,They enjoy <MASK> gatherings on weekends.,His <MASK> behavior at the formal event was scrutinized closely by the company’s board members.,Am Wochenende genießen sie <MASK>-Treffen.,Sein <MASK>-Verhalten bei der offiziellen Veranstaltung wurde von den Vorstandsmitgliedern des Unternehmens genau unter die Lupe genommen.
73,blond,blond,COGNATE,ADJ,She has <MASK> hair.,"The model’s <MASK> hair shone under the bright lights of the runway, making her the center of attention.",Sie hat <MASK>-Haare.,Die <MASK>-Haare des Models leuchteten unter den hellen Lichtern des Laufstegs und machten sie zum Mittelpunkt der Aufmerksamkeit.
74,local,lokal,COGNATE,ADJ,He visits the <MASK> market often.,The <MASK> government passed a new ordinance to regulate street vendors and support small businesses in the community.,Er besucht den <MASK>-Markt oft.,Die <MASK>-Regierung hat eine neue Verordnung zur Regulierung von Straßenverkäufern und zur Unterstützung kleiner Unternehmen in der Gemeinde verabschiedet.
75,ideal,ideal,COGNATE,ADJ,It was an <MASK> day for a picnic.,"The architect designed an <MASK> house that combined sustainability, style, and comfort in a perfect balance.",Es war ein <MASK>-Tag für ein Picknick.,"Der Architekt entwarf ein <MASK>-Haus, das Nachhaltigkeit, Stil und Komfort in perfekter Balance vereint."
76,unconventional,unkonventionell,COGNATE,ADJ,His <MASK> style is unique.,The <MASK> artist shocked the gallery crowd with an installation that challenged traditional notions of art and beauty.,Sein <MASK>-Stil ist einzigartig.,"Der <MASK>-Künstler schockierte das Galeriepublikum mit einer Installation, die traditionelle Vorstellungen von Kunst und Schönheit in Frage stellte."
77,warm,warm,COGNATE,ADJ,The room was not very <MASK>.,"After a long walk in the snow, the <MASK> fire in the cabin provided a much-needed comfort.",Das Zimmer war nicht sehr <MASK>.,Nach einem langen Spaziergang im Schnee sorgte das <MASK>-Feuer in der Hütte für die dringend benötigte Behaglichkeit.
78,wild,wild,COGNATE,ADJ,The forest is <MASK>.,"The <MASK> animals roamed freely through the dense jungle, far from human habitation.",Der Wald ist <MASK>.,"Die <MASK>-Tiere streiften frei durch den dichten Dschungel, fernab menschlicher Behausung."
79,elegant,elegant,COGNATE,ADJ,She looked <MASK> in the dress.,"The <MASK> décor of the ballroom, with its chandeliers and fine drapery, added to the opulence of the evening.",Sie sah in dem Kleid <MASK> aus.,Die <MASK>-Dekoration des Ballsaals mit Kronleuchtern und edlen Vorhängen trug zur Opulenz des Abends bei.
80,creative,kreativ,COGNATE,ADJ,He is <MASK> with his projects.,The designer’s <MASK> use of recycled materials in fashion gained recognition at the international show.,Er ist <MASK> mit seinen Projekten.,Die Verwendung von recycelten Materialien durch den Designer <MASK> in der Mode fand auf der internationalen Messe Anerkennung.
81,acceptable,akzeptabel,COGNATE,ADJ,The proposal she presented was <MASK>.,"Her <MASK> performance met the basic requirements for the job, but it didn’t impress the hiring manager.",Der von ihr vorgelegte Vorschlag war <MASK>.,"Ihre <MASK>-Leistung erfüllte die Grundvoraussetzungen für die Stelle, beeindruckte den Personalchef jedoch nicht."
82,active,aktiv,COGNATE,ADJ,She stays <MASK> throughout the day.,His <MASK> involvement in the charity led to significant improvements in local community services.,Sie bleibt den ganzen Tag <MASK>.,Sein <MASK>-Engagement für die Wohltätigkeitsorganisation führte zu erheblichen Verbesserungen der örtlichen Gemeindedienste.
83,new,neu,COGNATE,ADJ,The <MASK> student joined the class.,The <MASK> policy on waste reduction aims to cut landfill use by 30% over the next decade.,Der <MASK>-Schüler ist der Klasse beigetreten.,"Die <MASK>-Politik zur Abfallreduzierung zielt darauf ab, den Deponieverbrauch im nächsten Jahrzehnt um 30 % zu senken."
84,exclusive,exklusiv,COGNATE,ADJ,He was told that the club is <MASK>.,The <MASK> members-only club required a steep fee and personal referrals for admission.,"Ihm wurde gesagt, dass der Verein <MASK> sei.","Der <MASK>-Club, der nur Mitgliedern vorbehalten ist, verlangte für die Aufnahme eine hohe Gebühr und persönliche Empfehlungen."
85,exact,exakt,COGNATE,ADJ,The measurements were <MASK>.,The architect insisted on <MASK> specifications for the building's foundation to ensure it could withstand earthquakes.,Die Messungen waren <MASK>.,"Der Architekt bestand auf <MASK>-Spezifikationen für das Fundament des Gebäudes, um sicherzustellen, dass es Erdbeben standhält."
86,false.,falsch,COGNATE,ADJ,The statement was <MASK>.,"The media exposed the politician’s <MASK> claim about tax reforms, leading to a public apology.",Die Anweisung war <MASK>.,"Die Medien enthüllten die <MASK>-Behauptung des Politikers zu Steuerreformen, was zu einer öffentlichen Entschuldigung führte."
87,passive,passiv,COGNATE,ADJ,His responses were <MASK>.,Her <MASK> demeanor during the heated debate caused her to be overlooked by the more assertive speakers.,Seine Antworten waren <MASK>.,"Ihr <MASK>-Verhalten während der hitzigen Debatte führte dazu, dass sie von den selbstbewussteren Rednern übersehen wurde."
88,popular,popular,COGNATE,ADJ,This song seems to be <MASK>.,"The <MASK> tourist destination attracts millions of visitors every year, especially during the summer season.",Dieses Lied scheint <MASK> zu sein.,"Das Touristenziel <MASK> zieht jedes Jahr Millionen von Besuchern an, insbesondere in der Sommersaison."
89,best,besten,COGNATE,ADJ,She believes this is the <MASK> option.,The <MASK> athlete in the competition broke the world record and earned a gold medal.,"Sie glaubt, dass dies die Option <MASK> ist.",Der <MASK>-Athlet im Wettbewerb brach den Weltrekord und gewann eine Goldmedaille.
90,effective,effectiv,COGNATE,ADJ,The solution was <MASK>.,The <MASK> marketing campaign led to a significant increase in sales over the holiday season.,Die Lösung war <MASK>.,Die <MASK>-Marketingkampagne führte über die Weihnachtszeit zu einer deutlichen Umsatzsteigerung.
91,elastic,elastisch,COGNATE,ADJ,The material was <MASK>.,The <MASK> waistband of the running shorts allowed for maximum comfort and flexibility during workouts.,Das Material war <MASK>.,Der <MASK>-Bund der Laufshorts sorgt für maximalen Komfort und Flexibilität beim Training.
92,dumb,dumm,COGNATE,ADJ,His joke was <MASK>.,"The comedian's <MASK> humor surprisingly appealed to a wide audience, despite its lack of sophistication.",Sein Witz war <MASK>.,Der <MASK>-Humor des Komikers fand trotz seines Mangels an Raffinesse überraschend großen Anklang bei einem breiten Publikum.
93,intelligent,intelligent,COGNATE,ADJ,She is known to be very <MASK>.,"The <MASK> student solved the complex mathematical problem in minutes, impressing her professor.",Sie gilt als sehr <MASK>.,Die <MASK>-Studentin löste das komplexe mathematische Problem in wenigen Minuten und beeindruckte damit ihren Professor.
94,international,international,COGNATE,ADJ,The conference was <MASK>.,"The <MASK> trade agreement impacted businesses around the globe, shaping future economic partnerships.",Die Konferenz war <MASK>.,Das <MASK>-Handelsabkommen hatte Auswirkungen auf Unternehmen auf der ganzen Welt und prägte zukünftige Wirtschaftspartnerschaften.
95,legal,legal,COGNATE,ADJ,The <MASK> situation was quite confusing.,"The <MASK> battle over intellectual property rights lasted several years, with both companies claiming ownership.",Die <MASK>-Situation war ziemlich verwirrend.,"Der <MASK>-Kampf um geistige Eigentumsrechte dauerte mehrere Jahre, wobei beide Unternehmen Anspruch auf Eigentum erhoben."
96,brown,braun,COGNATE,ADJ,He wore a <MASK> jacket yesterday.,"The <MASK> bear wandered through the forest, foraging for food before the long winter hibernation.",Er trug gestern eine <MASK>-Jacke.,Der <MASK>-Bär wanderte durch den Wald und suchte vor dem langen Winterschlaf nach Nahrung.
97,gray,grau,COGNATE,ADJ,The sky was <MASK>.,"The <MASK> clouds signaled the approach of a thunderstorm, forcing people to seek shelter.",Der Himmel war <MASK>.,"Die <MASK>-Wolken signalisierten das Herannahen eines Gewitters und zwangen die Menschen, Schutz zu suchen."
98,old,alt,COGNATE,ADJ,The house across the street is <MASK>.,"The <MASK> castle stood on the hill, a relic of medieval times, attracting tourists from all over.",Das Haus auf der anderen Straßenseite ist <MASK>.,"Auf dem Hügel stand die Burg <MASK>, ein Relikt aus dem Mittelalter, die Touristen aus aller Welt anzog."
99,fat,fett,COGNATE,ADJ,The <MASK> cat sat on the mat.,"The veterinarian suggested a special diet for the <MASK> cat, as its weight posed a health risk.",Die <MASK>-Katze saß auf der Matte.,"Der Tierarzt empfahl eine spezielle Diät für die <MASK>-Katze, da ihr Gewicht ein Gesundheitsrisiko darstellte."
100,good,gut,COGNATE,ADJ,He is a <MASK> player.,"The <MASK> samaritan helped the elderly woman cross the street, showcasing a selfless act of kindness.",Er ist ein <MASK>-Spieler.,Der <MASK>-Samariter half der älteren Frau über die Straße und zeigte damit einen selbstlosen Akt der Güte.
101,young,jung,COGNATE,ADJ,The <MASK> dog ran around the yard.,"The <MASK> activist rallied her fellow students to campaign for climate action, gaining attention from the media.",Der <MASK>-Hund rannte im Hof ​​herum.,"Die <MASK>-Aktivistin versammelte ihre Kommilitonen, um sich für den Klimaschutz einzusetzen, und erregte damit die Aufmerksamkeit der Medien."
102,cold,kalt,COGNATE,ADJ,The drink was <MASK>.,The <MASK> winds sweeping down from the mountains made the winter morning feel even more frigid.,Das Getränk war <MASK>.,"Die <MASK>-Winde, die von den Bergen herabfegten, ließen den Wintermorgen noch kälter wirken."
103,hard,hart,COGNATE,ADJ,The floor is <MASK> to walk on.,The <MASK> surface of the marble floor made it difficult to walk in high heels without slipping.,Der Boden ist <MASK> zum Begehen.,"Die <MASK>-Oberfläche des Marmorbodens machte es schwierig, in High Heels zu gehen, ohne auszurutschen."
104,fresh,frisch,COGNATE,ADJ,The bread she served her guests was <MASK>.,"The <MASK> produce at the farmer’s market was hand-picked that morning, ensuring peak flavor and nutrition.","Das Brot, das sie ihren Gästen servierte, war <MASK>.","Die <MASK>-Produkte auf dem Bauernmarkt wurden an diesem Morgen von Hand gepflückt, um optimalen Geschmack und Nährwert zu gewährleisten."
105,emotional,emotional,COGNATE,ADJ,He felt <MASK> due to recent events.,"After hearing the <MASK> speech from the survivor, many in the audience were moved to tears.",Aufgrund der jüngsten Ereignisse fühlte er sich <MASK>.,"Nachdem sie die <MASK>-Rede des Überlebenden gehört hatten, waren viele im Publikum zu Tränen gerührt."
106,blind,blind,COGNATE,ADJ,The man walking on the road was <MASK>.,"The <MASK> artist created stunning sculptures, relying on his sense of touch to craft detailed works of art.","Der Mann, der auf der Straße ging, war <MASK>.","Der <MASK>-Künstler schuf atemberaubende Skulpturen und verließ sich dabei auf seinen Tastsinn, um detaillierte Kunstwerke zu erschaffen."
107,excellent,exzellent,COGNATE,ADJ,The trustees said that her presentation was <MASK>.,"The <MASK> student consistently earned top grades, securing her spot at a prestigious university.","Die Treuhänder sagten, dass ihre Präsentation <MASK> sei.",Die <MASK>-Studentin erzielte regelmäßig Bestnoten und sicherte sich so ihren Platz an einer renommierten Universität.
108,logical,logisch,COGNATE,ADJ,She believed that the argument was <MASK>.,"The lawyer’s <MASK> reasoning in court dismantled the opposing side's argument, leading to a favorable verdict.","Sie glaubte, dass das Argument <MASK> war.",Die Argumentation des Anwalts <MASK> vor Gericht entkräftete das Argument der Gegenseite und führte zu einem positiven Urteil.
109,official,offiziell,COGNATE,ADJ,He was unaware that the meeting was <MASK>.,"The <MASK> report on climate change was released by the government, prompting immediate discussions among world leaders.","Er wusste nicht, dass das Treffen <MASK> war.",Der <MASK>-Bericht zum Klimawandel wurde von der Regierung veröffentlicht und löste sofortige Diskussionen unter den Staats- und Regierungschefs der Welt aus.
110,sunny,sonnig,COGNATE,ADJ,It was a <MASK> day.,"The <MASK> beach was packed with tourists in the summer, all enjoying the clear skies and warm temperatures.",Es war ein <MASK>-Tag.,"Der <MASK>-Strand war im Sommer voller Touristen, die alle den klaren Himmel und die warmen Temperaturen genossen."
111,practical,praktisch,COGNATE,ADJ,The proposed plan was <MASK>.,Her <MASK> approach to problem-solving saved the company time and money on the project.,Der vorgeschlagene Plan war <MASK>.,Ihr <MASK>-Ansatz zur Problemlösung sparte dem Unternehmen Zeit und Geld für das Projekt.
112,fantastic,fantastisch,COGNATE,ADJ,Everybody in the audience thought that the movie was <MASK>.,The lead actor's <MASK> performance earned him a standing ovation and multiple award nominations.,"Jeder im Publikum dachte, der Film sei <MASK>.",Die <MASK>-Darbietung des Hauptdarstellers brachte ihm Standing Ovations und mehrere Nominierungen ein.
113,hungry,hungrig,COGNATE,ADJ,The kids were <MASK>.,"After a long day of hiking, they were <MASK> for a hearty meal at the local tavern.",Die Kinder waren <MASK>.,Nach einem langen Wandertag waren sie <MASK> für eine herzhafte Mahlzeit in der örtlichen Taverne.
114,normal,normal,COGNATE,ADJ,The doctors said that her test results were <MASK>.,The <MASK> growth rate of the plant indicated that the new fertilizer was effective.,"Die Ärzte sagten, dass ihre Testergebnisse <MASK> waren.","Die <MASK>-Wachstumsrate der Pflanze zeigte an, dass der neue Dünger wirksam war."
115,tolerant,tolerant,COGNATE,ADJ,He was <MASK> of others.,"The <MASK> community welcomed people from diverse backgrounds, fostering a sense of unity and respect.",Er war <MASK> anderer.,Die <MASK>-Community begrüßte Menschen mit unterschiedlichem Hintergrund und förderte ein Gefühl der Einheit und des Respekts.
116,modern,modern,COGNATE,ADJ,The design is <MASK> and chic.,"With its sleek glass façade, the <MASK> skyscraper dominated the city skyline and became a symbol of innovation.",Das Design ist <MASK> und schick.,Mit seiner eleganten Glasfassade dominierte der <MASK>-Wolkenkratzer die Skyline der Stadt und wurde zum Symbol für Innovation.
117,digital,digital,COGNATE,ADJ,The watch he is wearing is <MASK>.,"The <MASK> revolution has transformed the way we communicate, with smartphones and social media playing a central role.","Die Uhr, die er trägt, ist <MASK>.","Die <MASK>-Revolution hat die Art und Weise, wie wir kommunizieren, verändert, wobei Smartphones und soziale Medien eine zentrale Rolle spielen."
118,parallel,parallel,COGNATE,ADJ,The roads are <MASK>.,"The <MASK> paths of the two companies, once competitors, eventually converged through a merger that shook the industry.",Die Straßen sind <MASK>.,"Die <MASK>-Wege der beiden Unternehmen, die einst Konkurrenten waren, liefen schließlich durch eine Fusion zusammen, die die Branche erschütterte."
119,irrational,irrational,COGNATE,ADJ,His behavior was completely <MASK>.,"The man’s <MASK> fear of elevators prevented him from working in high-rise buildings, severely limiting his job options.",Sein Verhalten war völlig <MASK>.,"Die <MASK>-Angst des Mannes vor Aufzügen hinderte ihn daran, in Hochhäusern zu arbeiten, was seine Jobmöglichkeiten stark einschränkte."
120,liberal,liberal,COGNATE,ADJ,Her views were bold and <MASK>.,"The politician's <MASK> stance on immigration reform sparked debates across the country, dividing public opinion.",Ihre Ansichten waren mutig und <MASK>.,Die <MASK>-Haltung des Politikers zur Einwanderungsreform löste im ganzen Land Debatten aus und spaltete die öffentliche Meinung.
121,perfect,perfekt,COGNATE,ADJ,The work that her team submitted was <MASK>.,The <MASK> solution to the equation had eluded mathematicians for decades until it was finally discovered.,Die von ihrem Team eingereichte Arbeit war <MASK>.,"Die <MASK>-Lösung der Gleichung war den Mathematikern jahrzehntelang entgangen, bis sie schließlich entdeckt wurde."
122,political,politisch,COGNATE,ADJ,They discussed <MASK> matters.,"The <MASK> climate during the election year was tense, with debates intensifying across all media platforms.",Sie besprachen <MASK>-Angelegenheiten.,"Das <MASK>-Klima im Wahljahr war angespannt, und die Debatten intensivierten sich auf allen Medienplattformen."
123,potential,potenziell,COGNATE,ADJ,All teachers agreed that the student showed <MASK>.,"The young athlete’s <MASK> was evident during the national trials, where he outperformed seasoned competitors.","Alle Lehrer waren sich einig, dass der Schüler <MASK> zeigte.","Die <MASK> des jungen Athleten zeigte sich bei den nationalen Prüfungen, bei denen er erfahrene Konkurrenten hinter sich ließ."
124,blue,blau,COGNATE,ADJ,The sky is <MASK>.,"The <MASK> ocean stretched as far as the eye could see, meeting the horizon under the clear, sunny sky.",Der Himmel ist <MASK>.,"Der <MASK>-Ozean erstreckte sich so weit das Auge reichte und traf unter dem klaren, sonnigen Himmel auf den Horizont."
125,better,besser,COGNATE,ADJ,They agreed that this option was <MASK>.,The <MASK> candidate for the position demonstrated not only technical skills but also strong leadership abilities.,"Sie waren sich einig, dass diese Option <MASK> war.","Der <MASK>-Kandidat für die Position zeigte nicht nur technische Fähigkeiten, sondern auch starke Führungsqualitäten."
126,ripe,reif,COGNATE,ADJ,The fruit growing in his backyard is <MASK>.,"The <MASK> mangoes hung heavily from the tree, their sweet fragrance filling the orchard.",Die in seinem Hinterhof wachsenden Früchte sind <MASK>.,Die <MASK>-Mangos hingen schwer vom Baum und ihr süßer Duft erfüllte den Obstgarten.
127,bitter,bitter,COGNATE,ADJ,The coffee they had in the morning was <MASK>.,"The <MASK> aftertaste of the medicine lingered long after it was swallowed, making it hard to forget.","Der Kaffee, den sie morgens tranken, war <MASK>.","Der <MASK>-Nachgeschmack des Arzneimittels hielt noch lange nach dem Schlucken an und machte es schwer, ihn zu vergessen."
128,green,grün,COGNATE,ADJ,The grass is <MASK>.,"The <MASK> hills rolled gently across the landscape, dotted with wildflowers in bloom.",Das Gras ist <MASK>.,"Die <MASK>-Hügel rollten sanft über die Landschaft, übersät mit blühenden Wildblumen."
129,cool,kühl,COGNATE,ADJ,The air in this part of the country feels <MASK> .,The <MASK> breeze blowing from the ocean provided a welcome relief from the heat of the afternoon.,Die Luft in diesem Teil des Landes fühlt sich <MASK> an.,"Die <MASK>-Brise, die vom Meer wehte, sorgte für eine willkommene Abwechslung von der Hitze des Nachmittags."
130,white,weiß,COGNATE,ADJ,"He likes <MASK>, especially in his clothes.","The <MASK> dove flew across the sky, symbolizing peace.","Er mag <MASK>, besonders in seiner Kleidung.",Die <MASK>-Taube flog über den Himmel und symbolisierte Frieden.
131,windy,windig,COGNATE,ADJ,It was a <MASK> day.,The organizers were forced to cancel the outdoor event due to <MASK> conditions that disrupted their decorations.,Es war ein <MASK>-Tag.,"Die Organisatoren waren gezwungen, die Outdoor-Veranstaltung abzusagen, da <MASK>-Bedingungen ihre Dekoration beeinträchtigten."
132,alone,allein,COGNATE,ADJ,She was <MASK> in an unknown city.,"Despite being in a crowded room, he felt <MASK>, disconnected from the conversation around him.",Sie war <MASK> in einer unbekannten Stadt.,"Obwohl er sich in einem überfüllten Raum befand, fühlte er sich <MASK>, von der Unterhaltung um ihn herum getrennt."
133,broad,breit,COGNATE,ADJ,The street was <MASK> and lined with trees.,"The <MASK> avenue in the city center was lined with historic buildings, drawing the attention of tourists and locals alike.",Die Straße war <MASK> und von Bäumen gesäumt.,"Die <MASK>-Allee im Stadtzentrum war von historischen Gebäuden gesäumt, die die Aufmerksamkeit von Touristen und Einheimischen gleichermaßen auf sich zogen."
134,free,frei,COGNATE,ADJ,He felt <MASK> for the first time in many years.,"The artist felt <MASK> to explore unconventional techniques, leading to a unique and innovative body of work.",Zum ersten Mal seit vielen Jahren fühlte er sich <MASK>.,"Der Künstler hatte die <MASK>, unkonventionelle Techniken zu erforschen, was zu einem einzigartigen und innovativen Werk führte."
135,hasty,hastig,COGNATE,ADJ,He later realized that his decision was <MASK>.,"Her <MASK> retreat from the negotiation table left the deal in jeopardy, with both sides scrambling to recover.","Später wurde ihm klar, dass seine Entscheidung <MASK> war.","Ihr <MASK>-Rückzug vom Verhandlungstisch brachte den Deal in Gefahr, und beide Seiten kämpften darum, sich zu erholen."
136,naked,nackt,COGNATE,ADJ,"To everyone's shock, the man was <MASK>.","The sculptor's masterpiece featured a figure completely <MASK>, standing proudly in the gallery’s center.",Zum Schock aller war der Mann <MASK>.,"Das Meisterwerk des Bildhauers zeigte eine Figur, die vollständig <MASK> war und stolz in der Mitte der Galerie stand."
137,sour,sauer,COGNATE,ADJ,The lemon made the dish taste <MASK>.,The <MASK> flavor of the lemon was perfect for the refreshing lemonade on a hot summer day.,Durch die Zitrone schmeckte das Gericht <MASK>.,Der <MASK>-Geschmack der Zitrone war perfekt für die erfrischende Limonade an einem heißen Sommertag.
138,sharp,scharf,COGNATE,ADJ,The kitchen knife was <MASK>.,The <MASK> edge of the blade made it easy to slice through the dense bread without crumbling it.,Das Küchenmesser war <MASK>.,"Mit der <MASK>-Kante der Klinge ließ sich das dichte Brot leicht durchschneiden, ohne es zu zerbröseln."
139,high,hoch,COGNATE,ADJ,The mountain is <MASK>.,"The <MASK> peaks of the Himalayas are among the most challenging for mountaineers, drawing adventurers from around the globe.",Der Berg ist <MASK>.,Die <MASK>-Gipfel des Himalaya gehören zu den anspruchsvollsten für Bergsteiger und ziehen Abenteurer aus der ganzen Welt an.
140,national,national,COGNATE,ADJ,They raised the <MASK> flag.,"The <MASK> pride during the victory parade was palpable, as citizens lined the streets to cheer for their team.",Sie hissten die <MASK>-Flagge.,"Der <MASK>-Stolz während der Siegesparade war spürbar, als die Bürger die Straßen säumten, um ihr Team anzufeuern."
141,preservative,präservativ,FALSE COGNATE,N,Salt is a common <MASK> for food.,"This natural <MASK> slows down spoilage by limiting bacterial growth, helping keep the food fresh for longer periods.",Er kaufte eine <MASK> in der Apotheke.,"Die <MASK> trug das schwere Gewicht der Kutsche, ihr Stahlrahmen wurde bei jeder Drehung des Rades belastet."
142,axle,achsel,FALSE COGNATE,N,The car's <MASK> needs repair.,"The <MASK> bore the heavy weight of the carriage, its steel frame straining with every rotation of the wheel.",Sie berührte sanft seine <MASK>.,"Nach der langen Wanderung rieb sie ihre <MASK>, die vom Gewicht des Rucksacks wund war, und überlegte, ob sie eine Pause brauchte, bevor sie weitermachte."
143,acre,acker,FALSE COGNATE,N,That was their own <MASK> of land.,"On their sprawling <MASK>, they built a large farmhouse.",Die <MASK> wurde fleißig gepflügt.,"Die riesige <MASK> war bestellt und bereit für die Pflanzsaison, in der der Bauer Feldfrüchte säen würde, die die Gemeinschaft das ganze Jahr über ernähren würden."
144,arch,arche,FALSE COGNATE,N,The stone <MASK> marked the city entrance.,The ancient stone <MASK> in the Roman aqueduct still stands as a testament to engineering ingenuity.,Die <MASK> war groß und für alle ausreichend.,"Biblischen Berichten zufolge war Noahs <MASK> ein riesiges Gefäß, das dazu bestimmt war, Paare aller Tierarten zu beherbergen, um die drohende Flut zu überleben."
145,easel,esel,FALSE COGNATE,N,She set up her <MASK> by the window.,"Positioned by the sunlit window, the wooden <MASK> held a canvas teeming with vibrant brushstrokes.",Die <MASK> trug Taschen bergauf.,Die mit Getreidesäcken beladene <MASK> bahnte sich langsam ihren Weg den steilen Pfad hinauf und diente als unverzichtbares Lasttier im bergigen Gelände.
146,fabric,fabrik,FALSE COGNATE,N,The <MASK> felt soft and smooth.,"The delicate silk <MASK>, woven with care, glistened as it caught the light.",Die <MASK> produzierte Spielzeug.,"Das Fließband im <MASK> produzierte täglich Tausende von elektronischen Bauteilen, beschäftigte Hunderte von Arbeitern und trieb die Industriewirtschaft des Landes an."
147,fire,feier,FALSE COGNATE,N,She stared at the <MASK> in the distance.,"The <MASK> roared, its orange and blue flames dancing wildly, casting shadows across the room.",Am Ende des Jahres warfen sie eine <MASK>.,"Zum 200. Jahrestag ihrer Gründung veranstaltete die Stadt eine große <MASK> mit Feuerwerk, einer Parade und kulturellen Darbietungen, die Tausende von Zuschauern anzogen."
