ID,en,de,type,lexical_category,low_en,high_en,low_de,high_de
148,floss,flosse,FALSE COGNATE,N,She used <MASK> to clean her teeth.,"With a flick of her wrist, she deftly glided the <MASK> between her teeth, ensuring meticulous oral care.",Der Fisch hat eine <MASK>.,"Die <MASK> des Fisches auf dem Rücken stand hoch, während er durch das Wasser schwamm, was es ihm ermöglichte, seine Stabilität zu bewahren und sich schnell durch die Strömungen zu bewegen."
149,geniality,genialität,FALSE COGNATE,N,His <MASK> made everyone feel welcome.,"His <MASK>, a warm and effortless charm, eased the tension in the room, making strangers feel like old friends.",Seine Arbeit hob seine <MASK> hervor.,"Seine <MASK> in der Astrophysik wurde weithin anerkannt, insbesondere für seine bahnbrechende Arbeit über Schwarze Löcher, die unser Verständnis des Universums verändert hat."
150,grip,grippe,FALSE COGNATE,N,She tightened her <MASK> on the handle.,"Her <MASK> was firm and unyielding, conveying confidence and control over the situation.",Sie hatte die <MASK>.,"Im Jahr 1918 verbreitete sich <MASK> schnell auf der ganzen Welt, infizierte Millionen Menschen und führte zu weitreichenden gesellschaftlichen und wirtschaftlichen Störungen."
151,hole,höhle,FALSE COGNATE,N,There’s a <MASK> in my sock.,"Through the narrow <MASK> in the wall, they could glimpse a hidden world beyond.",Die unerforschte <MASK> war dunkel.,Die <MASK> bot mit ihren antiken Stalaktiten und Stalagmiten einen faszinierenden Einblick in die geologische Geschichte der Erde.
152,eagle,egel,FALSE COGNATE,N,An <MASK> flew high above.,"The <MASK> soared high above the cliffs, scanning the valley for its prey.",Die <MASK> saugte Blut.,"Die <MASK> klebte an seiner Haut und ernährte sich von seinem Blut, während er im Sumpf stand, eine Erinnerung an die gefährlichen Kreaturen, die in den trüben Gewässern lauerten."
153,kiss,kissen,FALSE COGNATE,N,They shared a <MASK> on the doorstep.,"The gentle <MASK> lingered on her lips, an unspoken promise exchanged between them in the dim evening light.",Sie saß auf einer weichen <MASK>.,"Ihre <MASK>, gefüllt mit Federn, wiegte ihren Kopf, während sie in einen friedlichen Schlaf sank."
154,kitchen,kittchen,FALSE COGNATE,N,The <MASK> smelled of freshly baked bread.,"The <MASK> buzzed with life, aromas of spices and herbs blending in the warm, inviting atmosphere.",Er war in <MASK>.,"Das für seine harten Bedingungen bekannte <MASK> beherbergte Tausende von Insassen, von denen vielen wegen Gewaltdelikten lange Haftstrafen drohten."
155,cot,kot,FALSE COGNATE,N,She put the baby to sleep in the <MASK>.,"The small <MASK>, draped with a soft blanket, held a sleeping infant nestled in peaceful dreams.",Da war <MASK> im Hof.,Die Anwesenheit von Tieren <MASK> in der archäologischen Stätte lieferte Hinweise auf die Domestizierung der frühen Nutztiere und das tägliche Leben antiker Zivilisationen.
156,cup,kuppe,FALSE COGNATE,N,She poured tea into the <MASK>.,"Steam rose from the porcelain <MASK>, warming her hands and filling her senses with the rich scent of tea leaves.",Seine <MASK> tat weh.,"Die <MASK> seines Fingers berührte sanft das zerbrechliche Pergament, wobei er darauf achtete, das jahrhundertealte Manuskript nicht zu beschädigen, während er vorsichtig die Seiten umblätterte."
157,lock,lok,FALSE COGNATE,N,He turned the <MASK> on the door.,"The heavy iron <MASK> clicked, securing the door with an air of finality.",Die <MASK> war groß.,Der mächtige Dampf <MASK> tuckerte mit seinem wogenden Rauch und zischenden Dampf über die Gleise und zog schwere Fracht durch das industrielle Herzland der Nation.
158,prank,pranke,FALSE COGNATE,N,The <MASK> was unexpected.,"His clever <MASK>, though harmless, brought a lighthearted laughter to everyone involved.",Der Löwe hat eine <MASK>.,"Die massive <MASK> des Löwen, an deren Zehen scharfe Krallen angebracht waren, hinterließ tiefe Spuren in der staubigen Erde, als er auf der Suche nach seiner nächsten Mahlzeit durch die Savanne streifte."
159,pregnancy,prägnanz,FALSE COGNATE,N,Her <MASK> was a joyful time.,"She navigated her <MASK> with grace, each day bringing new emotions about starting a family and a deepening sense of connection with her husband.",Sie waren beeindruckt von der <MASK> seines Vortrags.,"Die <MASK> seines Berichts beeindruckte den Vorstand, da er wichtige Informationen in weniger als fünf Minuten übermittelte, unnötige Details vermied und gleichzeitig eine überzeugende Argumentation darlegte."
160,rank,ranke,FALSE COGNATE,N,He held a high <MASK> in the army.,"Achieving the <MASK> required years of dedication, valor, and countless sacrifices on the field.",Die Rebe hatte eine <MASK>.,"Die <MASK> der kriechenden Rebe rollte sich nach oben und suchte Halt am Spalier, ein Beweis für das Bedürfnis der Pflanze nach vertikalem Wachstum, um das Sonnenlicht zu erreichen."
161,side,seide,FALSE COGNATE,N,She chose to stand by his <MASK>.,"Standing at his <MASK>, she felt a deep sense of solidarity and shared purpose.",Sie trug ein <MASK>-Kleid.,"Der <MASK>-Stoff, bekannt für seine glatte Textur und seinen luxuriösen Glanz, ist seit Jahrhunderten ein Symbol für Reichtum und Eleganz und wird oft in feinsten Kleidungsstücken und dekorativen Künsten verwendet."
162,siege,sieg,FALSE COGNATE,N,The castle was under <MASK>.,"During the lengthy <MASK>, supplies dwindled as the defenders clung to hope against the overwhelming forces.",Sie feierten ihre <MASK>.,Die <MASK> der Mannschaft in der nationalen Meisterschaft war ein Beweis für ihren unerschütterlichen Einsatz und ihr Können und markierte einen historischen Moment für den Verein und seine Fans.
163,strife,streife,FALSE COGNATE,N,The family endured much <MASK>.,"The years of <MASK> had left scars, but their resilience grew stronger with each hardship faced.",Die Polizei fuhr fort: <MASK>.,"Das Militär <MASK> drang tief in den Wald vor und hielt eine dichte Formation aufrecht, um die Sicherheit des Gebiets zu gewährleisten, und war bereit, auf jede Bedrohung durch Aufständische zu reagieren."
164,stool,stuhl,FALSE COGNATE,N,He sat on a wooden <MASK>.,"She posed on the wooden <MASK>, carefully watching the artist as he painted.",Sie saß auf der <MASK>.,"Die <MASK> unterstützte seine Haltung, während er stundenlang vor dem Computer saß, förderte den Komfort und beugte Rückenschmerzen vor."
165,trap,trappe,FALSE COGNATE,N,The <MASK> was set to catch the thief.,"In the silent corner, the <MASK> lay in wait, its trigger sensitive to even the slightest movement.",Die <MASK> flog davon.,"Der <MASK>, ein großer, bodenlebender Vogel, der in offenem Grasland vorkommt, ist für seine beeindruckenden Balzkünste bekannt, bei denen das Männchen seine Brust aufbläht und dröhnende Rufe ausstößt."
166,treasure,tresor,FALSE COGNATE,N,They found <MASK> under the old tree.,"The pirate crew unearthed a chest filled with <MASK>, its gold coins gleaming in the sunlight.",Er öffnete die <MASK>.,Die aus verstärktem Stahl gefertigte und mit einem ausgeklügelten Verschlussmechanismus ausgestattete <MASK> enthielt wertvolle Dokumente und Wertgegenstände.
167,whip,wippe,FALSE COGNATE,N,She held a <MASK> in her hand.,"With a swift motion, the <MASK> snapped, the sound echoing across the field, commanding attention.",Die Kinder spielten auf der <MASK>.,Die in leuchtenden Farben bemalte hölzerne <MASK> knarrte unter dem Gewicht der Kinder und sorgte so für stundenlangen Spielspaß auf dem Spielplatz.
168,resin,rosine,FALSE COGNATE,N,The tree produced a sticky <MASK>.,"The amber-colored <MASK> oozed slowly from the bark, capturing tiny insects in its viscous embrace.",Sie hat eine <MASK> gegessen.,"Die auf natürliche Weise in der Sonne getrocknete <MASK> war reich an Antioxidantien und wurde häufig beim Backen verwendet, um Brot, Kuchen und Müsliriegeln Süße und Textur zu verleihen."
169,rent,rente,FALSE COGNATE,N,They couldn’t afford the <MASK> this month.,"With the <MASK> overdue, the fear of becoming homeless loomed over their lives.",Sein Großvater erhielt seine <MASK> pünktlich.,"Nach einer langen Karriere hatte sie Anspruch auf eine <MASK>, die ihr im Ruhestand finanzielle Stabilität verschaffte und ihr einen komfortablen Lebensstil ermöglichte."
170,bean,biene,FALSE COGNATE,N,He ate a <MASK> from his salad.,"After roasting, the room was filled with the rich aroma of the coffee <MASK>, signaling the start of a perfect morning.",Die <MASK> flog vorbei.,"Die <MASK> landete mit ihren zarten Flügeln, die in der Luft summten, auf der Blume und sammelte Nektar und Pollen."
171,clip,klippe,FALSE COGNATE,N,She used a <MASK> to hold the papers together.,"The metal <MASK>, small but sturdy, kept the scattered papers in perfect order.",Die <MASK> ragte aus dem Meer.,"Die gewaltige <MASK>, die sich abrupt aus der Meeresoberfläche erhob, hatte Jahrhunderte lang Gezeiten und Stürme überstanden."
172,ass,as,FALSE COGNATE,N,They took an <MASK> up the mountain.,"The stubborn old <MASK>, laden with goods, trod steadily up the steep, rocky path.",Er hatte die Pik <MASK>.,Im Pokerspiel wird die Pik <MASK> oft als die mächtigste Karte angesehen und symbolisiert Glück und strategische Vorteile in Spielen mit hohen Einsätzen.
173,back,backe,FALSE COGNATE,N,He brushed the dust off his <MASK>.,The supportive pat on his <MASK> offered a sense of reassurance in a moment of doubt.,Sie zwickte ihre <MASK>.,"Ihre <MASK> errötete vor Aufregung, als sie die Bühne betrat und die hellen Lichter vor dem gespannten Publikum einen warmen Glanz auf ihr Gesicht warfen."
174,baggage,bagage,FALSE COGNATE,N,They left their <MASK> behind.,"After the long flight, he struggled to find his <MASK> at the carousel.",Die <MASK> schlenderte um die Ecke.,Die <MASK> hing oft auf der Straße und trug zu einer Atmosphäre der Unordnung und Spannung im Stadtviertel bei.
175,ban,bann,FALSE COGNATE,N,The school imposed a <MASK> on the use of cellphones.,The citywide <MASK> sought to curtail the disruptive influence of technology in public spaces.,Er murmelte leise eine <MASK>.,"Der Zauberer wirkte eine <MASK>, die das Gefüge der Realität veränderte und ein Portal zu einem anderen Reich voller Fabelwesen und verborgener Schätze öffnete."
176,barrack,baracke,FALSE COGNATE,N,They returned to the <MASK> after training.,"The soldiers huddled in the dim <MASK>, exchanging stories of home to ease the evening’s chill.",Die Familie lebte in einer <MASK>.,"In den weitläufigen Slums bot die <MASK>, hergestellt aus geborgenen Metallblechen und Holzbrettern, der Familie nur minimalen Schutz."
177,beast,biest,FALSE COGNATE,N,The <MASK> roared in the night.,"The <MASK> emerged from the forest, its eyes glowing with an ominous red hue.",Das Kind war eine <MASK>.,"Die verwöhnte <MASK> bekam im Laden einen Wutanfall, als sie das Spielzeug, das sie wollte, nicht bekam."
178,blend,blende,FALSE COGNATE,N,He enjoyed the <MASK> of flavors.,The vibrant <MASK> of spices created an aroma that filled the room with warmth and richness.,Er hat die <MASK> angepasst.,"Der Fotograf hat die <MASK> der Kamera sorgfältig angepasst, um die Menge des in das Objektiv einfallenden Lichts zu kontrollieren und sicherzustellen, dass die Aufnahme perfekt belichtet und der Hintergrund für einen künstlerischen Effekt unscharf ist."
179,bone,bohne,FALSE COGNATE,N,She broke a <MASK> while playing football.,"The delicate <MASK>, fractured and bruised, needed careful tending to heal properly.",Er hat eine <MASK> gegessen.,"Die <MASK>, ein Grundnahrungsmittel vieler Küchen auf der ganzen Welt, ist nicht nur eine nahrhafte Nahrungsquelle, sondern spielt aufgrund ihrer stickstofffixierenden Eigenschaften im Boden auch eine wichtige Rolle in der Fruchtfolge."
180,brand,brand,FALSE COGNATE,N,They launched a new <MASK> of coffee.,"Known for quality, the <MASK> became synonymous with luxury and indulgence.",Er begann eine <MASK> in der Scheune.,"Die lodernde <MASK>, angetrieben von trockenem Holz, knisterte und brüllte, während sie sich schnell durch den Wald ausbreitete."
181,bucket,bukett,FALSE COGNATE,N,He filled the <MASK> with water.,"The <MASK> sloshed heavily, brimming with cool water from the well.",Sie erhielt bei der Veranstaltung eine <MASK>.,"Die sorgfältig mit Rosen, Lilien und Lavendelzweigen arrangierte <MASK> erfüllte den Raum mit einem zarten Duft und symbolisierte Liebe und Rücksichtnahme zu einem besonderen Anlass."
182,chore,chor,FALSE COGNATE,N,Doing laundry is a mundane <MASK>.,"Each <MASK>, though repetitive, kept the household running smoothly and in order.",Die <MASK> hat wunderschön gesungen.,"Die <MASK>, bestehend aus Stimmen vom zarten Sopran bis zum tiefen Bass, harmonierte perfekt."
183,clue,clou,FALSE COGNATE,N,They found a <MASK> at the crime scene.,"The tiny <MASK>, barely visible, held the key to unraveling the entire mystery.",Die Geschichte hat ihre <MASK> erreicht.,"Die <MASK> des Films entfaltete sich mit atemberaubender Intensität, als der Protagonist sich seiner größten Angst stellte, einem Moment der Spannung, der das Publikum atemlos hielt und auf das Endergebnis wartete."
184,disgust,degustation,FALSE COGNATE,N,She felt <MASK> because of the foul smell.,"A wave of <MASK> washed over her as she recoiled from the scene, unable to bear the stench.",Wir gingen zu einem Wein <MASK>.,"Die <MASK>-Veranstaltung bot ein immersives Erlebnis, bei dem jeder Schluck Wein Schichten reichhaltiger Aromen und subtiler Noten offenbarte und die Teilnehmer auf eine Reise fachmännisch kuratierter Aromen führte."
185,device,devise,FALSE COGNATE,N,The <MASK> was used for measuring distance.,"The compact <MASK>, crafted with precision, transformed complex measurements into accessible data.",Die <MASK> der Schule inspirierte die Schüler.,"Die <MASK> der Akademie, „Wissen ist Macht“, erinnerte die Schüler ständig an die Bedeutung des Lernens und vermittelte ihnen ein Gefühl der Zielstrebigkeit und des Stolzes auf ihrem Bildungsweg."
186,dome,dom,FALSE COGNATE,N,The church had an impressive <MASK>.,"The ancient temple’s <MASK> rose majestically above the city, symbolizing both power and grace.",Sie besuchten eine <MASK>.,Die hoch aufragende <MASK> mit ihren aufwendigen Buntglasfenstern und hohen Bögen war ein Zeugnis jahrhundertelanger Glaubens und Kunstfertigkeit und faszinierte die Besucher mit ihrer ehrfurchtsvollen Schönheit.
187,dose,dose,FALSE COGNATE,N,A small <MASK> of the syrup was enough.,"She carefully measured each <MASK> of medicine, mindful of its potency and effects on the patient's recovery.",Er öffnete eine <MASK> Limonade.,"Das kalte, mit Kondenswasser bedeckte Metall <MASK> enthielt einen sprudelnden Hauch von Süße, der an einem sengenden Sommertag für erfrischende Linderung sorgte."
188,fart,fahrt,FALSE COGNATE,N,The unexpected <MASK> broke the silence.,"The sound of the <MASK> echoed in the quiet room, bringing both embarrassment and laughter.",Sie machten eine lange <MASK>.,"Die <MASK> über den Kontinent, voller malerischer Ausblicke und unerwarteter Umwege, wurde zu einem transformativen Erlebnis."
189,flint,flinte,FALSE COGNATE,N,They used <MASK> to start a fire.,"The hunter struck the <MASK> against the steel, sparking a fire in the wilderness.",Er hielt eine <MASK>.,"Die doppelläufige <MASK>, sorgfältig aus poliertem Holz und Stahl gefertigt, lag bereit in seinen Händen, ein mächtiges Werkzeug für die Jagd, aber auch ein Symbol der Verteidigung in der abgelegenen Wildnis."
190,flock,flocke,FALSE COGNATE,N,A <MASK> of sheep grazed in the meadow.,"The <MASK> of birds moved as one, a graceful formation of wings that filled the sky with a rhythmic symphony of beating wings.",Die <MASK> landete auf ihrem Handschuh.,"Die zarte <MASK>, einzigartig in ihrer kristallinen Struktur, funkelte im Sonnenlicht, als sie sanft herabglitt, und ihre flüchtige Schönheit schmolz bei Kontakt mit ihrem warmen Handschuh."
191,actual,aktuell,FALSE COGNATE,ADJ,This is the <MASK> reason for the delay.,The <MASK> reason for the delay was carefully hidden beneath layers of excuses.,Dies ist das <MASK>-Modell.,Das <MASK>-Modell spiegelt die neuesten Fortschritte im Design wider und erfasst sowohl Innovationen als auch die sich ändernden Bedürfnisse der heutigen Benutzer.
192,brave,brav,FALSE COGNATE,ADJ,She made a <MASK> decision.,"With a <MASK> resolve, she faced her fears and took control of the situation.",Der Hund war <MASK>.,"Der <MASK>-Hund saß aufmerksam an der Seite seines Besitzers, den Blick konzentriert, und wartete mit unerschütterlicher Loyalität auf einen Befehl."
193,curious,kurios,FALSE COGNATE,ADJ,He was <MASK> about the noise.,"The <MASK> child wandered through the museum, eagerly examining every exhibit and asking questions.",Er hat eine <MASK>-Sprache.,"Seine Art zu sprechen, unterbrochen von abrupten Pausen und einem ungewöhnlichen Rhythmus, verlieh ihm einen <MASK>-Charme, der noch lange anhielt, nachdem er den Raum verlassen hatte."
194,ordinary,ordinär,FALSE COGNATE,ADJ,It was an <MASK> day.,"On an <MASK> day like any other, nothing remarkable stood out to remember.",Sie hat einen <MASK>-Kommentar abgegeben.,"Ihr <MASK>-Kommentar, gespickt mit bissigem Sarkasmus, hinterließ eine unangenehme Stille im Raum, während sich die Leute unruhig hin und her bewegten."
195,pathetic,pathetisch,FALSE COGNATE,ADJ,His excuse sounded <MASK>.,"With a voice laced with defeat, his excuse was so <MASK> that it bordered on embarrassing.",Die Geschichte war voller <MASK>.,"Die Geschichte war eine kraftvolle Mischung aus Freude und Trauer, voller <MASK>, als sie sich mit den rohen Verletzlichkeiten des menschlichen Lebens befasste."
196,sensible,sensibel,FALSE COGNATE,ADJ,She gave a <MASK> answer.,"Her answer was measured and <MASK>, a response rooted in clarity and reason.",Er ist <MASK> gegenüber Kritik.,Mit seiner sanften Art war er zutiefst <MASK> und empfand selbst die geringste Kritik oft als eine tiefe Einsicht in seinen Charakter.
197,sympathetic,sympathisch,FALSE COGNATE,ADJ,He was <MASK> to her struggles.,"With a <MASK> gaze, he listened to her troubles, showing true empathy.",Er ist eine <MASK>-Person.,"Sein lockerer Charme und sein aufrichtiges Lächeln machten ihn sofort zu <MASK>, eine magnetische Präsenz in jedem Raum."
198,frivolous,frivol,FALSE COGNATE,ADJ,Her concerns seemed <MASK>.,"Her worries seemed <MASK>, overshadowed by the weightier issues around her.",Sein Witz war <MASK>.,"Der Witz, der die Grenzen des Anstands sprengte, blieb unbehaglich hängen, sein <MASK>-Charakter war allen klar, außer dem, der ihn erzählte."
199,ghostly,geistlich,FALSE COGNATE,ADJ,The mist looked <MASK> in the moonlight.,"Bathed in eerie moonlight, the mist took on a <MASK> quality that sent shivers down the spine.",Sie hat eine <MASK>-Einstellung.,"Ihre <MASK>-Perspektive, die tief in der alten Weisheit verwurzelt ist, erfüllte ihr Leben mit Sinnhaftigkeit und ruhiger Selbstbeobachtung."
200,gracious,graziös,FALSE COGNATE,ADJ,She gave a <MASK> reply.,"Her <MASK> reply, full of poise and warmth, diffused the tension in the room.",Der Tänzer war <MASK>.,"Der Tänzer bewegte sich mit <MASK> Flüssigkeit, jeder Schritt war eine zarte Mischung aus Kraft und Eleganz, die das Publikum fesselte."
201,guilty,gültig,FALSE COGNATE,ADJ,He felt <MASK> about lying.,"He stood in the courtroom, his <MASK> expression betraying the remorse he felt for his actions.",Dieses Ticket ist <MASK>.,"Sie erhielt Zutritt zum exklusiven Club, indem sie ihre <MASK>-Mitgliedskarte vorlegte."
202,happy,happig,FALSE COGNATE,ADJ,She was <MASK> to see him.,"Her face lit up with genuine joy, <MASK> to be in his presence after so long.",Diese Uhr ist <MASK>.,"Die Uhr, ein eleganter Beweis für Handwerkskunst und Luxus, trug den <MASK>-Preis eines echten Sammlerstücks."
203,costly,köstlich,FALSE COGNATE,ADJ,The repair was <MASK>.,"The <MASK> repair bill came as a shock, much higher than he’d anticipated.",Das Essen war <MASK>.,"Die <MASK>-Mahlzeit strotzt nur so vor Aromen, und jede Zutat ergibt zusammen ein reichhaltiges, herzhaftes Erlebnis, das herrlich am Gaumen verweilt."
204,pregnant,prägnant,FALSE COGNATE,ADJ,She was <MASK> and glowing.,"The <MASK> woman gently cradled her belly, feeling the first movements of her baby.",Der Bericht ist <MASK>.,"Obwohl der Bericht <MASK> war, war er akribisch prägnant und erfasste komplexe Ideen klar und präzise."
205,lusty,lustig,FALSE COGNATE,ADJ,She gave him a <MASK> smile when they crossed paths.,"She gave a <MASK> performance, captivating everyone with her powerful voice.",Die Show war <MASK>.,"Die Show war <MASK>, mit klugem Witz und unerwarteten Wendungen, die das Publikum in Gelächter versetzten."
206,restless,restlos,FALSE COGNATE,ADJ,He felt <MASK> before the exam.,"After hours of waiting, the <MASK> crowd began to murmur, growing more agitated as the event was delayed.",Es ist ein voller Erfolg <MASK>.,"Der Gesamterfolg des <MASK> war ein Beweis für die harte Arbeit und die einwandfreie Ausführung des Teams, bei der kein Detail außer Acht gelassen wurde."
207,slim,schlimm,FALSE COGNATE,ADJ,She was <MASK> and elegant.,"With a <MASK>, graceful frame, she moved with an elegance that was hard to ignore.",Er machte eine <MASK>-Bemerkung.,"Seine Bemerkung war <MASK> und voller Gift, was einen bitteren Schauer hinterließ."
208,sinful,sinnvoll,FALSE COGNATE,ADJ,He dismissed it as a <MASK> pleasure.,"The indulgence was a <MASK> pleasure, one he could hardly resist despite his guilt.",Diese Arbeit ist <MASK>.,"Die Geschichte war eine kraftvolle Mischung aus Freude und Trauer, voller <MASK>, als sie sich mit den rohen Verletzlichkeiten des menschlichen Lebens befasste."
209,adroit,adrett,FALSE COGNATE,ADJ,She was <MASK> in her response.,"Her <MASK> response, quick and clever, left her opponent momentarily speechless.",Sein Zimmer war <MASK>.,"Die Geschichte war eine kraftvolle Mischung aus Freude und Trauer, voller <MASK>, als sie sich mit den rohen Verletzlichkeiten des menschlichen Lebens befasste."
210,adequate,adäquat,FALSE COGNATE,ADJ,The results were <MASK>.,"The outcome was <MASK>, meeting the minimum expectations but lacking in brilliance.",Das war eine <MASK>-Antwort.,"Ihre Reaktion war ruhig und maßvoll und traf genau den richtigen Ton, eine <MASK>-Reaktion auf eine heikle Situation."
211,blamable,blamabel,FALSE COGNATE,ADJ,He was <MASK> for the mistake.,The manager deemed the employees <MASK> for the project's failure due to their repeated mistakes.,Sein Verhalten war <MASK>.,"Seine von Täuschung und Verrat geprägten Taten warfen einen <MASK> Schatten, der seinen Ruf nachhaltig beeinträchtigte."
212,devoted,devot,FALSE COGNATE,ADJ,She was <MASK> to her work.,"She was a <MASK> volunteer, spending her weekends at the animal shelter caring for abandoned pets.",Der Hund ist <MASK>.,Die <MASK>-Haltung des Hundes mit zurückgelegten Ohren und gesenktem Schwanz zeigte eine stille Akzeptanz des Befehls seines Besitzers.
213,foul,faul,FALSE COGNATE,ADJ,The smell was <MASK>.,"A <MASK> stench filled the air, nearly unbearable to anyone nearby.",Bei ihm geht es <MASK> um Hausarbeiten.,Mit einer entspannten Gleichgültigkeit war er <MASK> und ließ seine Aufgaben immer unvollendet.
214,homely,heimlich,FALSE COGNATE,ADJ,She had a <MASK> charm.,"Her charm was <MASK> and unpretentious, endearing to everyone around her.",Sie hielten ein <MASK>-Treffen ab.,"Das <MASK>-Treffen fand im Schutz der Dunkelheit statt, seine Einzelheiten wurden nur wenigen Vertrauenswürdigen zugeflüstert."
215,inconsequential,inkonsequent,FALSE COGNATE,ADJ,The comment was <MASK>.,"His comment, though <MASK>, had an unintended ripple effect on the group’s mood.",Seine Arbeit ist <MASK>.,"Seine Leistung schwankte unvorhersehbar, eine <MASK> Mischung aus Brillanz und Unaufmerksamkeit, die andere verunsicherte."
216,cross,kroß,FALSE COGNATE,ADJ,She looked <MASK> at the noise.,"<MASK> and visibly irritated, she cast a glare in the direction of the sound.",Das Huhn ist <MASK>.,"Der goldene <MASK>-Überzug des Hühnchens knisterte beim ersten Bissen und machte Platz für zartes, saftiges Fleisch darunter."
217,mundane,mondän,FALSE COGNATE,ADJ,The task felt <MASK>.,"Repetitive and <MASK>, the task drained her enthusiasm with every passing minute.",Ihr Kleid ist <MASK>.,"Ihr Kleid, eine gewagte Mischung aus zeitgenössischem Stil und zeitloser Eleganz, machte sie zum Inbegriff der <MASK>-Raffinesse."
218,net,nett,FALSE COGNATE,ADJ,They measured the <MASK> profit.,Calculating the <MASK> profit required thorough accounting of all revenue and expenses.,Sie ist eine <MASK>-Person.,"Sie war eine <MASK>-Person, deren Herzlichkeit und aufrichtige Freundlichkeit es leicht machten, mit ihr zu reden."
219,eventual,eventuell,FALSE COGNATE,ADJ,The <MASK> outcome was uncertain.,"After months of waiting, the <MASK> outcome remained a mystery until the final moment.","Es ist <MASK>, früher fertig zu werden.","Das Projekt früher als geplant abzuschließen, war völlig <MASK>, solange alle effizient arbeiteten und konzentriert blieben."
220,rusty,rüstig,FALSE COGNATE,ADJ,The bike’s chain was <MASK>.,The old bike’s <MASK> chain creaked loudly with every pedal.,Das alte Paar war <MASK>.,Das alte Ehepaar ging jeden Abend mit einer <MASK>-Energie durch den Garten.
221,scrupulous,skrupellos,FALSE COGNATE,ADJ,She was <MASK> in her work.,Her <MASK> attention to detail ensured that no error went unnoticed.,Er war ein <MASK> Geschäftsmann.,"Seine von einer dreisten Missachtung der Ethik geprägten Geschäfte entlarvten ihn als <MASK>-Betreiber, der wenig Respekt vor Fairness hatte."
