ID,en,de,type,lexical_category,low_en,high_en,low_de,high_de
222,spendable,spendabel,FALSE COGNATE,ADJ,The funds were <MASK>.,"With the money finally <MASK>, he could start planning his next big purchase.",Sie war sehr <MASK>.,"Ihre <MASK>-Natur ging über materielle Gaben hinaus und umfasste eine wahre Freundlichkeit, die jeden, den sie traf, wärmte."
223,sufficient,süffisant,FALSE COGNATE,ADJ,The water was <MASK>.,"<MASK> for the journey, the water supply was carefully rationed.",Er trug einen <MASK>-Look.,"Sein selbstzufriedenes Grinsen war unverkennbar <MASK>, als hätte sein kleiner Sieg seine Überlegenheit gegenüber allen bewiesen."
224,temperamental,temperamentvoll,FALSE COGNATE,ADJ,Her mood was <MASK>.,"With a <MASK> nature, her emotions shifted from joy to irritation with little warning.",Die Party war <MASK>.,"Der Raum war voller <MASK>-Gespräche, Gelächter und Musik und schuf eine elektrisierende Atmosphäre, die den Abend unvergesslich machte."
225,unkindly,unkindlich,FALSE COGNATE,ADJ,He spoke to her in an <MASK> manner at the meeting.,"Treated in an <MASK> manner, he endured the insults with quiet resilience.",Das Kind ist <MASK>.,"Das <MASK>-Kind zeigte Weisheit, die über sein Alter hinausging, und sprach mit einer Beredsamkeit, die Erwachsene sowohl amüsierte als auch beeindruckte."
226,ungracious,ungraziös,FALSE COGNATE,ADJ,She gave an <MASK> response.,"Her response was <MASK>, a curt reply that left little room for goodwill.",Seine Bewegungen waren <MASK>.,"Jeder Schritt war unbeholfen und unsicher, sein <MASK>-Gang kontrastierte mit der Eleganz seiner Umgebung."
227,wounded,wund,FALSE COGNATE,ADJ,He was <MASK> in the fight.,"Badly <MASK> in the fight, he struggled to move, each step a painful effort.",Seine Haut war vom Laufen in der Sonne <MASK>.,"Die Haut zwischen seinen Beinen fühlte sich <MASK> und wund an, jede Bewegung erinnerte ihn daran, wie sehr seine Beine beim Laufen gescheuert waren."
228,wonderful,wunderlich,FALSE COGNATE,ADJ,The view was <MASK>.,"The view was a <MASK> sight, an awe-inspiring landscape that took her breath away.",Er hatte eine <MASK>-Angewohnheit.,"Seine Angewohnheit, Gegenstände ohne erkennbaren Zweck neu anzuordnen, kam anderen als <MASK> vor, fast schon eigenartig."
229,unalphabetical,analphabetisch,FALSE COGNATE,ADJ,The list was <MASK>.,"<MASK> and disorganized, the list made it hard to locate anything quickly.",Er war <MASK>.,"Der Mann war <MASK> und hatte sich schon lange auf Freunde verlassen, die ihm dabei halfen, die Komplexität des modernen Lebens zu meistern."
230,exalted,exaltiert,FALSE COGNATE,ADJ,The praise felt <MASK>.,"His <MASK> praise bordered on reverence, as if she were a figure to be idolized.",Seine Geschichte war <MASK>.,"Jedes Detail in seiner Geschichte war so <MASK>, dass die Realität unter den Ausschmückungen kaum noch zu erkennen war."
231,comical,komisch,FALSE COGNATE,ADJ,The movie was <MASK>.,"Filled with <MASK> moments, the movie had the entire audience laughing from start to finish.","Es ist <MASK>, dass er heute nicht zur Arbeit gekommen ist.",Das ist wirklich eine <MASK>-Situation.
232,serious,seriös,FALSE COGNATE,ADJ,His tone was <MASK>.,"Speaking in a <MASK> tone, he made it clear that he wasn’t joking about the matter.",Ihre Entschuldigung war <MASK>.,"Wie tief ihr Bedauern war, zeigte sich in ihrer <MASK>-Entschuldigung, die sie mit einer Demut vorbrachte, die selbst den größten Skeptiker bewegte."
233,indecent,indezent,FALSE COGNATE,ADJ,His behavior was <MASK>.,"His <MASK> behavior shocked everyone, crossing the lines of acceptable conduct.",Sie war <MASK> über die Pläne.,"Ihre beiläufige, <MASK> Erwähnung vertraulicher Details löste bei allen Bedenken hinsichtlich ihrer Fähigkeit aus, Diskretion zu wahren."
234,communal,kommunal,FALSE COGNATE,ADJ,They shared <MASK> interests.,"United by <MASK> interests, the group worked toward a common goal that benefited all.",Sie haben die <MASK>-Dienste verbessert.,"Die <MASK>-Dienste des Stadtrats verzeichneten erhebliche Verbesserungen, die den Bewohnern in Bereichen vom öffentlichen Nahverkehr bis zur Abfallentsorgung zugute kamen."
235,crafty,kräftig,FALSE COGNATE,ADJ,Her strategy was <MASK>.,"With a <MASK> approach, she outmaneuvered her rivals, leaving them scrambling to catch up.",Der Sturm war <MASK>.,Die <MASK>-Winde des Sturms fegten durch die Landschaft und hinterließen eine Spur der Zerstörung.
236,lilac,lila,FALSE COGNATE,ADJ,She wore a <MASK> dress.,"The <MASK> dress she wore brought a soft elegance, complementing her gentle features.",Sie trug ein <MASK>-Kleid.,"Die tiefe, königliche <MASK> ihres Kleides betonte ihre Präsenz, ein satter Farbton, der fast königlich wirkte."
237,lumpy,lumpig,FALSE COGNATE,ADJ,The soup was a bit <MASK>.,"The <MASK> texture of the soup hinted at a rushed preparation, with ingredients barely mixed.",Er machte eine <MASK>-Bemerkung.,Seine vor Bosheit triefende Bemerkung war unverkennbar <MASK> und hinterließ ein bitteres Schweigen.
238,middle-aged,mittelalterlich,FALSE COGNATE,ADJ,He was <MASK> and content.,"<MASK> and settled, he’d reached a point of peace and stability in his life.",Die Struktur ist <MASK>.,Die schroffen Steinmauern und schmalen Bogenfenster des Schlosses spiegelten seine <MASK>-Ursprünge wider und zeugen von der Geschichte.
239,momentous,momentan,FALSE COGNATE,ADJ,The decision was <MASK>.,"A <MASK> decision that changed everything, it became the turning point of his career.",Es gab eine <MASK>-Pause.,"Die Stille war nur <MASK>, eine flüchtige Pause, bevor der Raum erneut in Gespräche ausbrach."
240,personal,personell,FALSE COGNATE,ADJ,She kept her thoughts <MASK>.,"Guarding her thoughts closely, she maintained a <MASK> boundary few could cross.",Er stellte der Verwaltung <MASK> Fragen.,Das Memo enthielt vertrauliche <MASK>-Informationen über wichtige Änderungen in den Rollen und Verantwortlichkeiten des Sicherheitspersonals.
241,boot,boot,FALSE COGNATE,N,She slipped on her <MASK> and headed outside.,"The worn leather <MASK>, caked in layers of mud, hinted at journeys through rugged, unforgiving landscapes.",Sie haben eine neue <MASK> gekauft.,"Die <MASK> glitt lautlos über den nebligen See, ihre Ruder schnitten durch das Wasser, während die Morgendämmerung den Himmel in sanfte, leuchtende Farben tauchte."
242,provision,provision,FALSE COGNATE,N,There was a <MASK> for extra time.,The <MASK> of medical supplies during the crisis helped save many lives.,Sie hat eine <MASK> erhalten.,"Dem Künstler wurde eine <MASK> für die Erstellung eines Porträts anvertraut, und er spürte die Last seiner Verantwortung, in jedem Pinselstrich sowohl Ähnlichkeit als auch Seele einzufangen."
243,gift,gift,FALSE COGNATE,N,She handed him a small <MASK>.,"Wrapped in shimmering paper, the <MASK> held a thoughtful note that spoke louder than the present itself.",Das Getränk enthielt <MASK>.,"Obwohl die Phiole mit <MASK> klein war, hatte sie das tödliche Potenzial, jedes Lebewesen sofort zu töten."
244,chef,chef,FALSE COGNATE,N,The <MASK> prepared the meal.,"Moving with practiced skill, the <MASK> transformed simple ingredients into a vibrant, aromatic dish.",Ihre <MASK> ist streng.,"Die imposante Präsenz der <MASK> beherrschte den Raum, sein Blick war scharf, als er seine Mitarbeiter musterte."
245,fee,fee,FALSE COGNATE,N,There’s a <MASK> for late payments.,The hefty <MASK> underscored the urgency of handling matters on time.,Die Geschichte handelte von einer <MASK>.,Die <MASK> mit schimmernden Flügeln schwebte in strahlendem Glanz und verbreitete einen Hauch von Magie über dem dunklen Waldboden.
246,island,island,FALSE COGNATE,N,They visited a tropical <MASK>.,"The secluded <MASK>, with its golden sands and lush greenery, seemed untouched by time.",<MASK> hat wunderschöne Landschaften.,"Die rauen Landschaften von <MASK> mit seinen hoch aufragenden Gletschern, dramatischen Wasserfällen und dampfenden Geysiren machen es zu einem der schönsten Länder, die man besuchen kann."
247,kind,kind,FALSE COGNATE,N,He was always <MASK> to others.,"Her <MASK> nature radiated, bringing comfort to everyone she encountered.",Eine <MASK> rannte an uns vorbei.,"Die <MASK> lachte, während sie im Park auf der Wippe spielte."
248,angel,angel,FALSE COGNATE,N,"Sometimes, she acted like an <MASK>.","The ancient cathedral’s stained glass depicted each <MASK> in vivid color, symbolizing purity, protection, and hope that transcended the centuries.",Er hielt die <MASK>.,"Die <MASK> beugte sich unter dem Gewicht des Fisches, als sie ihren Fang herauszog."
249,anger,anger,FALSE COGNATE,N,His <MASK> was obvious.,"The <MASK> simmered in his eyes, a silent storm barely held at bay.",Die Schafe grasten in der <MASK>.,"Die üppige, grüne <MASK> erstreckte sich weit und war ein Zufluchtsort für grasende Schafe im Dorf."
250,hut,hut,FALSE COGNATE,N,They stayed in a <MASK> by the beach.,"The little <MASK>, with its thatched roof and ocean views, provided simple shelter under the vast sky.",Sie trug eine große <MASK>.,"Ihre breitkrempige <MASK>, elegant zur Seite geneigt, warf einen sanften Schatten auf ihr Gesicht und deutete auf Geheimnis und zeitlosen Stil hin."
251,mist,mist,FALSE COGNATE,N,The <MASK> rolled over the hills.,"The morning <MASK> blanketed the valley, turning the landscape into a soft, ethereal dreamscape.",Der Bauer verbreitete <MASK>.,"Die frische <MASK>, reichhaltig und würzig, wurde sorgfältig auf den Feldern verteilt und versorgte den Boden mit Nährstoffen, die für das neue Wachstum der Saison wichtig sind."
252,plane,plane,FALSE COGNATE,N,The <MASK> took off on time.,"With a gentle roar, the <MASK> soared above the clouds, heading toward its distant destination.",Die <MASK> schützt das Auto vor Regen.,Die <MASK> ist an mehreren Stellen zerrissen.
253,rock,rock,FALSE COGNATE,N,A large <MASK> blocked the path.,"The jagged <MASK>, weathered by time, seemed to guard the entrance to the hidden trail.",Sie trug eine lange <MASK>.,"Ihre fließende <MASK> fing beim Gehen die Brise ein, und ihr zarter Stoff erzeugte bei jedem Schritt einen faszinierenden Tanz aus Farben und Falten."
254,stapler,stapler,FALSE COGNATE,N,The <MASK> was on the desk.,"The heavy-duty <MASK>, with its polished metal and sturdy grip, was a constant presence in the office.",Er fuhr eine <MASK>.,"Die <MASK> rumpelte durch das Lagerhaus und manövrierte geschickt Paletten und Kisten, wobei ihr Bediener Kraft und Präzision im Gleichgewicht hielt."
255,taste,taste,FALSE COGNATE,N,The soup had a strange <MASK>.,"The <MASK> of the exotic spices lingered, rich and unfamiliar, awakening the senses with every sip.","Er musste die <MASK>-Taste drücken, um zu starten.",Mit einem leichten Druck auf die <MASK> entfaltet sich auf dem Computerbildschirm eine Welt digitaler Befehle.
256,teller,teller,FALSE COGNATE,N,He spoke to the <MASK> about his balance.,"At the bank, the <MASK> meticulously counted stacks of bills, ensuring no error in the large transaction.",Die <MASK> war voller Essen.,"Die <MASK>, kunstvoll arrangiert mit leuchtendem Grün, zarten Schnitten und delikaten Saucen, war eine Leinwand aus Farben und Texturen, die zu einem Fest für die Sinne einlud."
257,sole,sole,FALSE COGNATE,N,The <MASK> left a faint impression in the sand.,"The worn <MASK> of the shoe bore the marks of long journeys, each step imprinted on the rugged surface.",<MASK> brennt in den Augen.,"Der Geruch von <MASK>, scharf und belebend, klebte an ihrer Haut und erinnerte sie an den riesigen, ungezähmten Ozean dahinter."
258,auditorium,auditorium,FALSE COGNATE,N,The <MASK> was packed with people.,The grand <MASK> hummed with energy as anticipation grew among the sea of attendees.,Die <MASK> war still.,"Die prächtige <MASK> mit ihren Sitzreihen und der imposanten Tafel und dem Podium diente als Zufluchtsort des Wissens, in dem die Stimmen früherer Gelehrter in stiller Ehrfurcht verweilten."
259,beet,beet,FALSE COGNATE,N,She added <MASK> to the salad.,The vibrant <MASK> slices added a touch of earthy sweetness and color to the simple green salad.,Sie hat Samen in die <MASK> gepflanzt.,"Die <MASK>, reich an dunkler, feuchter Erde, wartete auf die zarten Triebe und Samen, die sie bald in einen Hauch von Grün und Farbe verwandeln würden."
260,blitz,blitz,FALSE COGNATE,N,He saw live updates about the <MASK> on TV.,"In the early hours of the conflict, the air force launched a <MASK>, overwhelming the defenses and causing significant casualties across the strategic target zones.",<MASK> erleuchtete den Himmel.,"Mitten in starkem Regen spaltete <MASK> den Nachthimmel mit heftiger Intensität und erleuchtete die Landschaft in einem plötzlichen, rauen Feuer, das so schnell verblasste, wie es aufgetaucht war."
261,genial,genial,FALSE COGNATE,ADJ,His <MASK> smile put everyone at ease.,"His <MASK> smile, warm and welcoming, was enough to break the ice in any tense situation.",Sie hatte eine <MASK>-Idee.,"Ihre Strategie war so <MASK>, dass sie mehrere Probleme mit einer einzigen, mühelosen Lösung löste."
262,plump,plump,FALSE COGNATE,ADJ,The cat was <MASK> and content.,"With its <MASK>, round belly and lazy purr, the cat exuded pure satisfaction.",Er war <MASK> mit seinen Worten.,Seine <MASK>-Formulierung verwirrte die Botschaft und ließ sein Publikum verwirrt und unsicher über seine Absichten zurück.
263,alert,alert,FALSE COGNATE,ADJ,She was <MASK> to any noise in the room.,"The guard remained <MASK>, his senses attuned to the slightest sound in the darkened corridor, ready to react instantly to any sign of danger.",Sie hatte eine <MASK>-Persönlichkeit.,"Ihre <MASK>-Energie erhellte den Raum, ihr Lachen war ansteckend und ihre Begeisterung grenzenlos."
264,blank,blank,FALSE COGNATE,ADJ,The page was left <MASK>.,"A stark, <MASK> page sat on the table, holding endless possibilities within its emptiness.",Das Auto war <MASK>.,"Der Lack des Autos glänzte im Sonnenlicht, seine Oberfläche war so <MASK>, dass sie alles um sich herum wie ein Spiegel reflektierte."
265,fast,fast,FALSE COGNATE,ADJ,The car is <MASK> on highways.,"The athlete's <MASK> movements blurred as he dashed through the final stretch, his speed defying expectation and leaving competitors trailing far behind.",Er <MASK> hat den Zug verpasst.,"Er hatte nur noch wenige Sekunden Zeit, um auf den Bahnsteig zu stürmen, wobei <MASK> den abfahrenden Zug verpasste, als dieser davonfuhr."
266,patent,patent,FALSE COGNATE,ADJ,The <MASK> protects the invention.,The inventor applied for a <MASK> to protect his groundbreaking new technology from being copied by competitors.,Es ist ein <MASK>-Werkzeug zum Kochen.,Das Mehrzweckwerkzeug erwies sich als <MASK> in der Küche und rationalisierte Aufgaben mit überraschender Effizienz und Leichtigkeit.
267,punctual,punktuell,FALSE COGNATE,ADJ,She is always <MASK> to meetings.,"Her <MASK> arrival was a habit of precision, embodying her respect for everyone's time.",Sie war sehr <MASK> in Bezug auf ihre Kleidung.,"Ihr Geschmack war so <MASK>, dass sie oft Stunden damit verbrachte, nach genau dem richtigen Outfit zu suchen, um sicherzustellen, dass jedes Teil ihren einzigartigen Stil widerspiegelte."
268,purple,purpur,FALSE COGNATE,ADJ,He wore a <MASK> jacket.,"The <MASK> jacket, rich and bold, was impossible to miss, standing out in any crowd.",Ihr Kleid war <MASK>.,Die tiefe <MASK> ihres Kleides schien mit Intensität zu pulsieren und zog mit ihrem leuchtenden Farbton alle Blicke im Raum auf sich.
269,routine,routiniert,FALSE COGNATE,ADJ,His days followed a <MASK>.,"Bound to a <MASK>, his days unfolded predictably, each hour a reflection of the last.",Er ist ein <MASK>-Fahrer.,"Jahrelanges Navigieren auf anspruchsvollen Straßen machte ihn zu einem <MASK>-Fahrer, der sich instinktiv an alle plötzlichen Veränderungen auf der Fahrt anpasste."
270,small,schmal,FALSE COGNATE,ADJ,They lived in a <MASK> apartment.,"Their <MASK> apartment, compact yet cozy, held a charm that belied its modest size.",Sie hatte einen <MASK>-Rahmen.,"Ihre Figur war so <MASK> und anmutig, dass sie zu gleiten schien, jede Bewegung war von subtiler Eleganz geprägt."
271,scurrilous,skurril,FALSE COGNATE,ADJ,The book contained <MASK> remarks.,"Filled with <MASK> language, the book dared to challenge convention, sparking shock among its readers.",Die Idee war <MASK>.,"Der Vorschlag war so <MASK>, dass er Gelächter auslöste, und seine Absurdität machte es unmöglich, ihn ernst zu nehmen."
272,stark,stark,FALSE COGNATE,ADJ,The landscape was <MASK> and desolate.,"Against the wide, <MASK> expanse of desert, the lone cactus stood as a quiet monument to resilience.",Er war sehr <MASK>.,"Er war so <MASK>, dass er schwere Gegenstände mit Leichtigkeit heben konnte, wobei seine körperliche Leistungsfähigkeit in jeder Aktion sichtbar war."
273,strong,streng,FALSE COGNATE,ADJ,He had a <MASK> personality.,"With a <MASK> and unwavering personality, he could turn heads and command a room with ease.",Der Lehrer war <MASK> mit verspäteten Abgaben.,"Ihre Maßstäbe waren streng und <MASK>, ließen keinen Raum für Ausreden und erwarteten von jedem nur die höchste Qualität."
274,comfortable,komfortabel,FALSE COGNATE,ADJ,The chair was very <MASK>.,"Sinking into the plush, <MASK> chair, he felt every muscle release into a state of relaxation.",Das Hotel war <MASK>.,"Jede Ecke der Suite war <MASK>, von den edlen Möbeln über die Marmorausstattung bis hin zum exquisiten Dekor."
275,unsympathetic,unsympathisch,FALSE COGNATE,ADJ,Her tone was <MASK>.,"She spoke with an <MASK> tone, showing little regard for the challenges others faced.",Der Charakter in der Geschichte war <MASK>.,"Seine Arroganz und sein kaltes Auftreten machten ihn völlig zur <MASK> und entfremdeten sogar diejenigen, die versuchten, mitzufühlen."
276,unserious,unseriös,FALSE COGNATE,ADJ,The joke was <MASK>.,"Delivered with an <MASK> grin, the joke cut through the tension, lightening the mood instantly.",Seine Handlungen waren <MASK>.,"Der skandalöse Charakter seiner Entscheidungen führte dazu, dass er weithin als <MASK> angesehen wurde, was seinen Ruf irreparabel schädigte."
277,unashamed,unverschämt,FALSE COGNATE,ADJ,She was <MASK> of her past.,"<MASK> of the path she’d traveled, she wore her history openly, a testament to her resilience.",Er antwortete mit <MASK> auf die Kritik.,"Seine Reaktion war so <MASK> und trotzig, dass sie den Kritiker sprachlos machte, eine spielerische, aber kühne Herausforderung an die Autorität."
278,virtuous,virtuos,FALSE COGNATE,ADJ,He was <MASK> and well-respected.,"His <MASK> nature shone through in every act, earning the admiration of all who knew him.",Ihr Auftritt war <MASK>.,"Jede Note, die sie spielte, jede Pause, die sie machte, war <MASK> und offenbarte jahrelanges, bis zur Perfektion verfeinertes Können."
279,simpering,zimperlich,FALSE COGNATE,ADJ,She gave a <MASK> smile.,"Her <MASK> smile, forced and sugary-sweet, betrayed a hint of insincerity beneath the surface.",Es geht ihm <MASK> um Kritik.,"Selbst die mildeste Kritik würde ihn verärgern, da seine <MASK>-Natur es nahezu unmöglich macht, über Verbesserungen zu sprechen."
280,famous,famos,FALSE COGNATE,ADJ,The artist became <MASK> to the world after that exhibition.,"Renowned for her brilliant works, she became a <MASK> figure, celebrated across cultures and continents.",Das Konzert war <MASK>.,"Die Energie des Konzerts war <MASK>, und jedes Lied steigerte sich zu einer Spannung, die das Publikum in Ekstase versetzte."